{
  "$id": "tokenomics-overview-mcp/bigt",
  "$schema": "https://json-schema.org/draft/2020-12/schema",
  "additionalProperties": false,
  "properties": {
    "classes": {
      "items": {
        "additionalProperties": false,
        "properties": {
          "description": {
            "type": "string"
          },
          "fix": {
            "type": "string"
          },
          "headline": {
            "type": "string"
          },
          "name": {
            "type": "string"
          },
          "notation": {
            "type": "string"
          },
          "order": {
            "type": "integer"
          },
          "provenance": {
            "additionalProperties": false,
            "properties": {
              "document": {
                "type": "string"
              },
              "license": {
                "const": "CC-BY-4.0"
              },
              "section": {
                "type": [
                  "string",
                  "null"
                ]
              },
              "source_url": {
                "format": "uri",
                "type": "string"
              }
            },
            "required": [
              "document",
              "section",
              "source_url",
              "license"
            ],
            "type": "object"
          },
          "slug": {
            "type": "string"
          }
        },
        "required": [
          "slug",
          "order",
          "notation",
          "name",
          "headline",
          "description",
          "fix",
          "provenance"
        ],
        "type": "object"
      },
      "type": "array"
    },
    "expansion": {
      "type": "string"
    },
    "notation": {
      "type": "string"
    },
    "variables": {
      "items": {
        "additionalProperties": false,
        "properties": {
          "description": {
            "type": "string"
          },
          "name": {
            "type": "string"
          },
          "provenance": {
            "additionalProperties": false,
            "properties": {
              "document": {
                "type": "string"
              },
              "license": {
                "const": "CC-BY-4.0"
              },
              "section": {
                "type": [
                  "string",
                  "null"
                ]
              },
              "source_url": {
                "format": "uri",
                "type": "string"
              }
            },
            "required": [
              "document",
              "section",
              "source_url",
              "license"
            ],
            "type": "object"
          },
          "symbol": {
            "type": "string"
          }
        },
        "required": [
          "symbol",
          "name",
          "description",
          "provenance"
        ],
        "type": "object"
      },
      "type": "array"
    }
  },
  "required": [
    "notation",
    "expansion",
    "variables",
    "classes"
  ],
  "type": "object"
}
